{
  "schema": "agent-memory-production-ga-scorecard-input-v1",
  "classification": "production_external",
  "environment": "production",
  "scorecard_id": "ga-scorecard-2026q4",
  "metric_source_version": "ga-metrics-v1",
  "query_manifest_version": "ga-queries-v1",
  "target_version": "ga-targets-v1",
  "window_decision_version": "ga-window-v1",
  "inventory_id": "production-inventory",
  "inventory_receipt_sha256": "aaaaaaaaaaaaaaaaaaaaaaaaaaaaaaaaaaaaaaaaaaaaaaaaaaaaaaaaaaaaaaaa",
  "plan_id": "production-plan",
  "plan_receipt_sha256": "bbbbbbbbbbbbbbbbbbbbbbbbbbbbbbbbbbbbbbbbbbbbbbbbbbbbbbbbbbbbbbbb",
  "change_id": "production-change",
  "change_receipt_sha256": "cccccccccccccccccccccccccccccccccccccccccccccccccccccccccccccccc",
  "release_id": "production-release",
  "release_receipt_sha256": "dddddddddddddddddddddddddddddddddddddddddddddddddddddddddddddddd",
  "scorecard_export_sha256": "eeeeeeeeeeeeeeeeeeeeeeeeeeeeeeeeeeeeeeeeeeeeeeeeeeeeeeeeeeeeeeee",
  "query_manifest_sha256": "ffffffffffffffffffffffffffffffffffffffffffffffffffffffffffffffff",
  "window_decision_sha256": "1111111111111111111111111111111111111111111111111111111111111111",
  "target_decision_sha256": "2222222222222222222222222222222222222222222222222222222222222222",
  "product_domain_review_sha256": "3333333333333333333333333333333333333333333333333333333333333333",
  "window_approved_at": "2026-08-14T00:00:00Z",
  "window_start": "2026-08-15T00:00:00Z",
  "window_end": "2026-11-13T00:00:00Z",
  "evaluated_at": "2026-11-14T00:00:00Z",
  "generated_at": "2026-11-14T01:00:00Z",
  "approved_cost_per_active_tenant_microusd": 4000000,
  "ready": true,
  "metrics": [
    {"id":"api_availability_ppm","observed_value":999500,"expected_sample_count":10,"observed_sample_count":10,"evidence_sha256":"aaaaaaaaaaaaaaaaaaaaaaaaaaaaaaaaaaaaaaaaaaaaaaaaaaaaaaaaaaaaaaaa"},
    {"id":"search_p95_microseconds","observed_value":700000,"expected_sample_count":10,"observed_sample_count":10,"evidence_sha256":"aaaaaaaaaaaaaaaaaaaaaaaaaaaaaaaaaaaaaaaaaaaaaaaaaaaaaaaaaaaaaaaa"},
    {"id":"memory_write_p95_microseconds","observed_value":250000,"expected_sample_count":10,"observed_sample_count":10,"evidence_sha256":"aaaaaaaaaaaaaaaaaaaaaaaaaaaaaaaaaaaaaaaaaaaaaaaaaaaaaaaaaaaaaaaa"},
    {"id":"critical_high_exploitable_findings","observed_value":0,"expected_sample_count":10,"observed_sample_count":10,"evidence_sha256":"aaaaaaaaaaaaaaaaaaaaaaaaaaaaaaaaaaaaaaaaaaaaaaaaaaaaaaaaaaaaaaaa"},
    {"id":"tenant_isolation_passed","observed_value":1,"expected_sample_count":10,"observed_sample_count":10,"evidence_sha256":"aaaaaaaaaaaaaaaaaaaaaaaaaaaaaaaaaaaaaaaaaaaaaaaaaaaaaaaaaaaaaaaa"},
    {"id":"deletion_within_target_ppm","observed_value":1000000,"expected_sample_count":10,"observed_sample_count":10,"evidence_sha256":"aaaaaaaaaaaaaaaaaaaaaaaaaaaaaaaaaaaaaaaaaaaaaaaaaaaaaaaaaaaaaaaa"},
    {"id":"audit_integrity_verified_ppm","observed_value":1000000,"expected_sample_count":10,"observed_sample_count":10,"evidence_sha256":"aaaaaaaaaaaaaaaaaaaaaaaaaaaaaaaaaaaaaaaaaaaaaaaaaaaaaaaaaaaaaaaa"},
    {"id":"billing_reconciled_ppm","observed_value":1000000,"expected_sample_count":10,"observed_sample_count":10,"evidence_sha256":"aaaaaaaaaaaaaaaaaaaaaaaaaaaaaaaaaaaaaaaaaaaaaaaaaaaaaaaaaaaaaaaa"},
    {"id":"restore_rpo_minutes","observed_value":4,"expected_sample_count":10,"observed_sample_count":10,"evidence_sha256":"aaaaaaaaaaaaaaaaaaaaaaaaaaaaaaaaaaaaaaaaaaaaaaaaaaaaaaaaaaaaaaaa"},
    {"id":"restore_rto_minutes","observed_value":50,"expected_sample_count":10,"observed_sample_count":10,"evidence_sha256":"aaaaaaaaaaaaaaaaaaaaaaaaaaaaaaaaaaaaaaaaaaaaaaaaaaaaaaaaaaaaaaaa"},
    {"id":"cost_per_active_tenant_microusd","observed_value":3000000,"expected_sample_count":10,"observed_sample_count":10,"evidence_sha256":"aaaaaaaaaaaaaaaaaaaaaaaaaaaaaaaaaaaaaaaaaaaaaaaaaaaaaaaaaaaaaaaa"},
    {"id":"support_response_within_target_ppm","observed_value":1000000,"expected_sample_count":10,"observed_sample_count":10,"evidence_sha256":"aaaaaaaaaaaaaaaaaaaaaaaaaaaaaaaaaaaaaaaaaaaaaaaaaaaaaaaaaaaaaaaa"},
    {"id":"retention_deletions_within_target_ppm","observed_value":1000000,"expected_sample_count":10,"observed_sample_count":10,"evidence_sha256":"aaaaaaaaaaaaaaaaaaaaaaaaaaaaaaaaaaaaaaaaaaaaaaaaaaaaaaaaaaaaaaaa"}
  ],
  "checks": [
    {"id":"ga_window_approved","outcome":"passed","evidence_sha256":"aaaaaaaaaaaaaaaaaaaaaaaaaaaaaaaaaaaaaaaaaaaaaaaaaaaaaaaaaaaaaaaa"},
    {"id":"immutable_scorecard_export_complete","outcome":"passed","evidence_sha256":"aaaaaaaaaaaaaaaaaaaaaaaaaaaaaaaaaaaaaaaaaaaaaaaaaaaaaaaaaaaaaaaa"},
    {"id":"query_manifest_reviewed","outcome":"passed","evidence_sha256":"aaaaaaaaaaaaaaaaaaaaaaaaaaaaaaaaaaaaaaaaaaaaaaaaaaaaaaaaaaaaaaaa"},
    {"id":"metric_sample_coverage_complete","outcome":"passed","evidence_sha256":"aaaaaaaaaaaaaaaaaaaaaaaaaaaaaaaaaaaaaaaaaaaaaaaaaaaaaaaaaaaaaaaa"},
    {"id":"ga_targets_met","outcome":"passed","evidence_sha256":"aaaaaaaaaaaaaaaaaaaaaaaaaaaaaaaaaaaaaaaaaaaaaaaaaaaaaaaaaaaaaaaa"},
    {"id":"retention_coverage_and_target_met","outcome":"passed","evidence_sha256":"aaaaaaaaaaaaaaaaaaaaaaaaaaaaaaaaaaaaaaaaaaaaaaaaaaaaaaaaaaaaaaaa"},
    {"id":"product_domain_owner_review_complete","outcome":"passed","evidence_sha256":"aaaaaaaaaaaaaaaaaaaaaaaaaaaaaaaaaaaaaaaaaaaaaaaaaaaaaaaaaaaaaaaa"}
  ]
}
